all_seed_metrics.csv

arm,seed,complete_path,scope,total_return,equity,maxdd,sharpe_15m,daily_sharpe,annualized_volatility,sortino,cagr,calmar,bars,days,partial_dates,start,end,total_turnover,fold_normalized_cost_sum,mean_exposure
FIXED_I,11,True,new_retraining,0.7286066524202375,1.7286066524202375,0.7437440564796418,0.5275606781777117,0.5269210625072708,0.5572186020733445,0.7763003559798142,0.14881309932500497,0.20008643837690737,138224,1440,16,2022-01-01 00:15:00+00:00,2025-12-10 23:45:00+00:00,74.75,0.12765804240368483,1.0
FIXED_I,29,True,new_retraining,0.7286066524202375,1.7286066524202375,0.7437440564796418,0.5275606781777117,0.5269210625072708,0.5572186020733445,0.7763003559798142,0.14881309932500497,0.20008643837690737,138224,1440,16,2022-01-01 00:15:00+00:00,2025-12-10 23:45:00+00:00,74.75,0.12765804240368483,1.0
FIXED_I,47,True,new_retraining,0.7286066524202375,1.7286066524202375,0.7437440564796418,0.5275606781777117,0.5269210625072708,0.5572186020733445,0.7763003559798142,0.14881309932500497,0.20008643837690737,138224,1440,16,2022-01-01 00:15:00+00:00,2025-12-10 23:45:00+00:00,74.75,0.12765804240368483,1.0
FIXED_V,11,True,new_retraining,-0.2596713602017229,0.7403286397982771,0.7599780195246801,0.19313885190946348,0.17672100847294053,0.6048940837892639,0.2520336971037105,-0.0733776936709899,-0.09655238939263423,138224,1440,16,2022-01-01 00:15:00+00:00,2025-12-10 23:45:00+00:00,642.5,0.963140886924949,1.0
FIXED_V,29,True,new_retraining,-0.11160034765517501,0.888399652344825,0.710979680070107,0.27232802035225584,0.25852133751183276,0.6141059793852625,0.37091081401025233,-0.029548910685839758,-0.04156083712958723,138224,1440,16,2022-01-01 00:15:00+00:00,2025-12-10 23:45:00+00:00,641.75,0.9719217387441632,1.0
FIXED_V,47,True,new_retraining,0.5524503431706929,1.5524503431706929,0.7190799513450692,0.4882698663732568,0.4838109437301731,0.5899026055096658,0.7041397088919309,0.11793791456967129,0.16401224140523382,138224,1440,16,2022-01-01 00:15:00+00:00,2025-12-10 23:45:00+00:00,618.5,0.9589187353467338,1.0
FIXED_IV,11,True,new_retraining,-0.22334175979849435,0.7766582402015056,0.7530682054152905,0.21256866652468134,0.1972818380387722,0.6056296179197678,0.2816220893404221,-0.06205722448219242,-0.08240584854856546,138224,1440,16,2022-01-01 00:15:00+00:00,2025-12-10 23:45:00+00:00,642.75,0.9665043986809017,1.0
FIXED_IV,29,True,new_retraining,-0.06319661598060866,0.9368033840193913,0.7086676120322606,0.293342988921849,0.28016517999227436,0.6136327560967917,0.4021317374125502,-0.01641098484466952,-0.023157520628898788,138224,1440,16,2022-01-01 00:15:00+00:00,2025-12-10 23:45:00+00:00,643.0,0.9739073599195296,1.0
FIXED_IV,47,True,new_retraining,0.7910380745146697,1.7910380745146697,0.7272657994765392,0.5472807288079613,0.5448541901217354,0.5919915894026352,0.8013358702162152,0.1591911071902139,0.21888985746998435,138224,1440,16,2022-01-01 00:15:00+00:00,2025-12-10 23:45:00+00:00,612.0,0.9521897567935985,1.0
FIXED_FULL,11,True,new_retraining,-0.017557896604537104,0.9824421033954629,0.7491639368702452,0.2925878866496831,0.28192195750947224,0.5786375263692204,0.4033410204496194,-0.004479907821209106,-0.0059798765006290255,138224,1440,16,2022-01-01 00:15:00+00:00,2025-12-10 23:45:00+00:00,514.8000011444092,0.7792249129860035,1.0
WEEKLY_FULL,11,True,new_retraining,0.866968963824033,1.866968963824033,0.7343671196596588,0.5639723084068975,0.5626330736623543,0.5950484143295675,0.8248411206061991,0.1714553034139017,0.23347355678636914,138224,1440,16,2022-01-01 00:15:00+00:00,2025-12-10 23:45:00+00:00,,,
FIXED_FULL,29,True,new_retraining,0.041330497412474854,1.0413304974124749,0.7076532340501644,0.31971349125827075,0.3107699938468659,0.5859907833785566,0.4467625246710478,0.010318297534689158,0.01458100809577832,138224,1440,16,2022-01-01 00:15:00+00:00,2025-12-10 23:45:00+00:00,520.199999794364,0.7899864918406581,1.0
WEEKLY_FULL,29,True,new_retraining,0.8572600457699753,1.8572600457699753,0.7133550547554839,0.5621683504999989,0.5609747222736904,0.5976626496916704,0.8197740700561637,0.16990814570998736,0.23818173653823288,138224,1440,16,2022-01-01 00:15:00+00:00,2025-12-10 23:45:00+00:00,,,
FIXED_FULL,47,True,new_retraining,0.5584490037728449,1.558449003772845,0.7135250839997682,0.4855266454408735,0.4818088093769696,0.5756328057251014,0.7117816897435154,0.1190312645650704,0.1668214155805475,138224,1440,16,2022-01-01 00:15:00+00:00,2025-12-10 23:45:00+00:00,485.19998928904533,0.7466791221547051,1.0
WEEKLY_FULL,47,True,new_retraining,0.3668795637807911,1.3668795637807911,0.7491008417623402,0.4277031986339001,0.4220762380436847,0.5608551157331475,0.6071181803569653,0.0824400388520039,0.11005199067465318,138224,1440,16,2022-01-01 00:15:00+00:00,2025-12-10 23:45:00+00:00,,,
SAC_FULL,11,True,new_retraining,-0.7643197556337153,0.23568024436628462,0.8000606314153758,-0.42347018206948195,-0.46610150454092997,0.5081014571931448,-0.6483778474075821,-0.30673166934916274,-0.3833855301772919,138224,1440,16,2022-01-01 00:15:00+00:00,2025-12-10 23:45:00+00:00,1440.1206700354815,2.0792925252891603,0.8864801857348809
SAC_FULL,29,True,new_retraining,-0.7617712486186881,0.23822875138131192,0.782833381004276,-0.41612738769347557,-0.44922360623641955,0.5139922633706684,-0.6227710996700304,-0.3048391125817974,-0.3894048465213983,138224,1440,16,2022-01-01 00:15:00+00:00,2025-12-10 23:45:00+00:00,1387.260827332735,1.9405084808393598,0.8684504697125849
SAC_FULL,47,True,new_retraining,-0.6536381926744248,0.3463618073255752,0.7831528245762029,-0.24769006541462862,-0.2707554876934191,0.5108626292718637,-0.3845045868017764,-0.2356651793419794,-0.30091850778870366,138224,1440,16,2022-01-01 00:15:00+00:00,2025-12-10 23:45:00+00:00,1442.0552313774824,2.087861185857982,0.8895927456822598
SAC_FULL_NO_V,11,True,new_retraining,-0.5230324218924587,0.47696757810754126,0.8012376063620968,-0.17072530622592058,-0.16844580320726926,0.4673666089037535,-0.243958779227148,-0.17109290575325997,-0.2135357906253084,138224,1440,16,2022-01-01 00:15:00+00:00,2025-12-10 23:45:00+00:00,1054.2527366429567,1.4595679989426433,0.8795308172669586
SAC_FULL_NO_V,29,True,new_retraining,-0.31370895409629895,0.686291045903701,0.7152024564598257,0.025579255244034663,0.026467174166537818,0.46491099500817257,0.038548664342107096,-0.09100937568393586,-0.1272498085848619,138224,1440,16,2022-01-01 00:15:00+00:00,2025-12-10 23:45:00+00:00,833.6527519226074,1.2080726285922816,0.8747041375096531
SAC_FULL_NO_V,47,True,new_retraining,-0.535180771101948,0.46481922889805205,0.7701468752347446,-0.18853351391207734,-0.19225022820371251,0.46046249184744453,-0.27802224765855743,-0.17649591490884198,-0.22917176006855206,138224,1440,16,2022-01-01 00:15:00+00:00,2025-12-10 23:45:00+00:00,1145.281399205327,1.6507675660905763,0.884461599542297
SAC_FULL_NO_I,11,True,new_retraining,-0.7751459125141728,0.22485408748582722,0.8103996696801288,-0.4584601783306804,-0.4903775716406459,0.5077029770140332,-0.6814759640067654,-0.3149459279114556,-0.38863037547358237,138224,1440,16,2022-01-01 00:15:00+00:00,2025-12-10 23:45:00+00:00,1448.141225129366,2.0596379623909393,0.8786978404915937
SAC_FULL_NO_I,29,True,new_retraining,-0.7086583437073951,0.2913416562926049,0.7517249624136533,-0.33332535407764474,-0.3594115548891562,0.5086010412124913,-0.5008046517402928,-0.2684551909249264,-0.3571188989959376,138224,1440,16,2022-01-01 00:15:00+00:00,2025-12-10 23:45:00+00:00,1340.8492132723331,1.8774877338694496,0.8653244588431824
SAC_FULL_NO_I,47,True,new_retraining,-0.6523091312442926,0.3476908687557075,0.7898375182496644,-0.25343567389127125,-0.27210752711414377,0.5087922463387224,-0.3878296356108732,-0.23492283059228913,-0.297431845365987,138224,1440,16,2022-01-01 00:15:00+00:00,2025-12-10 23:45:00+00:00,1466.7317526489496,2.1049999179057464,0.8853686626171772
BTC,11,True,new_retraining,1.4158791516154707,2.4158791516154707,0.6791398982442713,0.6867036814764731,0.6856573000725696,0.5289432941131834,1.0310017899805355,0.25054384706490707,0.3689134561415387,138224,1440,16,2022-01-01 00:15:00+00:00,2025-12-10 23:45:00+00:00,16.0,0.024000000000000004,1.0
BTC,29,True,new_retraining,1.4158791516154707,2.4158791516154707,0.6791398982442713,0.6867036814764731,0.6856573000725696,0.5289432941131834,1.0310017899805355,0.25054384706490707,0.3689134561415387,138224,1440,16,2022-01-01 00:15:00+00:00,2025-12-10 23:45:00+00:00,16.0,0.024000000000000004,1.0
BTC,47,True,new_retraining,1.4158791516154707,2.4158791516154707,0.6791398982442713,0.6867036814764731,0.6856573000725696,0.5289432941131834,1.0310017899805355,0.25054384706490707,0.3689134561415387,138224,1440,16,2022-01-01 00:15:00+00:00,2025-12-10 23:45:00+00:00,16.0,0.024000000000000004,1.0
EQUAL,11,True,new_retraining,0.20674548298328177,1.2067454829832818,0.7335868947631201,0.4313962245859854,0.41613312787127305,0.6890934344480855,0.5855120325453912,0.04878703075229485,0.06650477414546574,138224,1440,16,2022-01-01 00:15:00+00:00,2025-12-10 23:45:00+00:00,16.000000000000036,0.024000000000000063,1.0
EQUAL,29,True,new_retraining,0.20674548298328177,1.2067454829832818,0.7335868947631201,0.4313962245859854,0.41613312787127305,0.6890934344480855,0.5855120325453912,0.04878703075229485,0.06650477414546574,138224,1440,16,2022-01-01 00:15:00+00:00,2025-12-10 23:45:00+00:00,16.000000000000036,0.024000000000000063,1.0
EQUAL,47,True,new_retraining,0.20674548298328177,1.2067454829832818,0.7335868947631201,0.4313962245859854,0.41613312787127305,0.6890934344480855,0.5855120325453912,0.04878703075229485,0.06650477414546574,138224,1440,16,2022-01-01 00:15:00+00:00,2025-12-10 23:45:00+00:00,16.000000000000036,0.024000000000000063,1.0
LARGE_CAP,11,True,new_retraining,0.691883339204475,1.691883339204475,0.6841460588780659,0.5181837225329435,0.5186677934367362,0.5485408094038532,0.7338906801646394,0.14257720722401723,0.20840170804729946,138224,1440,16,2022-01-01 00:15:00+00:00,2025-12-10 23:45:00+00:00,15.999999999999998,0.024000000000000004,1.0
LARGE_CAP,29,True,new_retraining,0.691883339204475,1.691883339204475,0.6841460588780659,0.5181837225329435,0.5186677934367362,0.5485408094038532,0.7338906801646394,0.14257720722401723,0.20840170804729946,138224,1440,16,2022-01-01 00:15:00+00:00,2025-12-10 23:45:00+00:00,15.999999999999998,0.024000000000000004,1.0
LARGE_CAP,47,True,new_retraining,0.691883339204475,1.691883339204475,0.6841460588780659,0.5181837225329435,0.5186677934367362,0.5485408094038532,0.7338906801646394,0.14257720722401723,0.20840170804729946,138224,1440,16,2022-01-01 00:15:00+00:00,2025-12-10 23:45:00+00:00,15.999999999999998,0.024000000000000004,1.0
MOMENTUM,11,True,new_retraining,0.4777091223137211,1.477709122313721,0.7714690681076435,0.5351066030828551,0.5106635867454504,0.7707231430878542,0.7682887436830996,0.10404325575290896,0.13486380731779612,138224,1440,16,2022-01-01 00:15:00+00:00,2025-12-10 23:45:00+00:00,159.66666666666666,0.24806719466257654,1.0
MOMENTUM,29,True,new_retraining,0.4777091223137211,1.477709122313721,0.7714690681076435,0.5351066030828551,0.5106635867454504,0.7707231430878542,0.7682887436830996,0.10404325575290896,0.13486380731779612,138224,1440,16,2022-01-01 00:15:00+00:00,2025-12-10 23:45:00+00:00,159.66666666666666,0.24806719466257654,1.0
MOMENTUM,47,True,new_retraining,0.4777091223137211,1.477709122313721,0.7714690681076435,0.5351066030828551,0.5106635867454504,0.7707231430878542,0.7682887436830996,0.10404325575290896,0.13486380731779612,138224,1440,16,2022-01-01 00:15:00+00:00,2025-12-10 23:45:00+00:00,159.66666666666666,0.24806719466257654,1.0

final_results_summary_report.md

## Strategy Ranking by Sharpe Ratio

1. Benchmark: BTC Buy & Hold: Sharpe 0.687, equity multiple 2.4159x, total return 141.59%, maximum drawdown 67.91%, average exposure 1.000.
2. Model: Agentic Alpha: Sharpe 0.562, equity multiple 1.8579x, total return 85.79%, maximum drawdown 66.40%, average exposure 1.000.
3. Benchmark: Top-3 7D Momentum: Sharpe 0.535, equity multiple 1.4777x, total return 47.77%, maximum drawdown 77.15%, average exposure 1.000.
4. Benchmark: Large Cap Equal Weight: Sharpe 0.518, equity multiple 1.6919x, total return 69.19%, maximum drawdown 68.41%, average exposure 1.000.
5. Benchmark: Equal Weight All Crypto: Sharpe 0.431, equity multiple 1.2067x, total return 20.67%, maximum drawdown 73.36%, average exposure 1.000.